"","Ent","Entidad","Fecha de Datos","Ppto Aprobado","Crédito Vigente","Comprometido","Devengado","Pagado","Saldo por Pagar","Deuda Flotante"
"310",1911,"Gobierno Municipal de Santa Rosa del Abuna",2003-01-31,1233544,1233544,0,0,0,0,0
"311",1912,"Gobierno Municipal de Ingavi (Humaita)",2003-01-31,723849,723849,0,0,0,0,0
"312",1913,"Gobierno Municipal de Nueva Esperanza",2003-01-31,425369,425369,0,0,0,0,0
"313",1914,"Gobierno Municipal de Villa Nueva (Loma Alta)",2003-01-31,631316,631316,0,0,0,0,0
"314",1915,"Gobierno Municipal de Santos Mercado",2003-01-31,429252,429252,0,0,0,0,0
